<?xml version="1.0"?>
<!--
webMethods BPI for Developers Training Course
Sample XML Message Purchase Order Acceptance
-->
<PurchaseOrderAcceptance xmlns:xsi="http://www.w3.org/2000/10/XMLSchema-instance" xsi:noNamespaceSchemaLocation="POAcceptance.xsd">
   <!--DOCTYPE PurchaseOrderAcceptance SYSTEM "PurchaseOrderAcceptance.dtd"-->
   <PurchaseOrder>
      <deliverTo>
         <PhysicalAddress>
            <cityName>
               <FreeFormText>Fairfax VA</FreeFormText>
            </cityName>
            <addressLine1>
               <FreeFormText>webMethods</FreeFormText>
            </addressLine1>
            <addressLine2>
               <FreeFormText>3877 Fairfax Ridge Road   South Tower</FreeFormText>
            </addressLine2>
            <addressLine3>
               <FreeFormText>Fairfax VA</FreeFormText>
            </addressLine3>
            <NationalPostalCode>22030</NationalPostalCode>
            <regionName>
               <FreeFormText>USA</FreeFormText>
            </regionName>
         </PhysicalAddress>
      </deliverTo>
      <GlobalPurchaseOrderStatusCode/>
      <GlobalShipmentTermsCode/>
      <RevisionNumber/>
      <GlobalPurchaseOrderAcknowledgementReasonCode/>
      <purchaseOrderDate>
         <DateStamp/>
      </purchaseOrderDate>
      <totalCost>4958</totalCost>
      <!-- This is the items array series -->
      <!-- Item 1 -->
      <ProductLineItem>
         <ProductQuantity/>
         <scheduledShipQuantity>
            <ProductQuantity/>
         </scheduledShipQuantity>
         <productUnit>
            <ProductPackageDescription>
               <unitPrice>
                  <FinancialAmount>
                     <GlobalCurrencyCode/>
                     <MonetaryAmount/>
                  </FinancialAmount>
               </unitPrice>
               <ProductIdentification/>
            </ProductPackageDescription>
         </productUnit>
         <GlobalShippingServiceLevelCode/>
         <scheduledShipDate>
            <DateStamp/>
         </scheduledShipDate>
         <GlobalPurchaseOrderStatusCode/>
         <GlobalPurchaseOrderAcknowledgementReasonCode/>
         <LineNumber/>
      </ProductLineItem>
      <!-- Item 2 -->
      <ProductLineItem>
         <ProductQuantity/>
         <scheduledShipQuantity>
            <ProductQuantity/>
         </scheduledShipQuantity>
         <productUnit>
            <ProductPackageDescription>
               <unitPrice>
                  <FinancialAmount>
                     <GlobalCurrencyCode/>
                     <MonetaryAmount/>
                  </FinancialAmount>
               </unitPrice>
               <ProductIdentification/>
            </ProductPackageDescription>
         </productUnit>
         <GlobalShippingServiceLevelCode/>
         <scheduledShipDate>
            <DateStamp/>
         </scheduledShipDate>
         <GlobalPurchaseOrderStatusCode/>
         <GlobalPurchaseOrderAcknowledgementReasonCode/>
         <LineNumber/>
      </ProductLineItem>
      <salesOrderIdentifier>
         <ProprietaryDocumentIdentifier/>
      </salesOrderIdentifier>
      <purchaseOrderNumber>
         <ProprietaryDocumentIdentifier/>
      </purchaseOrderNumber>
      <comment>
         <FreeFormText>Comments go here</FreeFormText>
      </comment>
   </PurchaseOrder>
   <fromRole>
      <PartnerRoleDescription>
         <GlobalPartnerRoleClassificationCode/>
         <DUNS>11-111-1111</DUNS>
         <PartnerDescription>
            <GlobalPartnerClassificationCode/>
            <BusinessDescription>
               <GlobalBusinessIdentifier/>
               <GlobalSupplyChainCode/>
            </BusinessDescription>
         </PartnerDescription>
      </PartnerRoleDescription>
   </fromRole>
   <toRole>
      <PartnerRoleDescription>
         <GlobalPartnerRoleClassificationCode/>
         <DUNS>88-888-8888</DUNS>
         <PartnerDescription>
            <GlobalPartnerClassificationCode/>
            <BusinessDescription>
               <GlobalBusinessIdentifier/>
               <GlobalSupplyChainCode/>
            </BusinessDescription>
         </PartnerDescription>
      </PartnerRoleDescription>
   </toRole>
   <thisDocumentGenerationDateTime>
      <DateTimeStamp>09 Mov 2005</DateTimeStamp>
   </thisDocumentGenerationDateTime>
   <thisDocumentIdentifier>
      <ProprietaryDocumentIdentifier>123</ProprietaryDocumentIdentifier>
   </thisDocumentIdentifier>
   <requestingDocumentIdentifier>
      <ProprietaryDocumentIdentifier/>
   </requestingDocumentIdentifier>
   <GlobalDocumentFunctionCode/>
   <requestingDocumentDateTime>
      <DateTimeStamp/>
   </requestingDocumentDateTime>
</PurchaseOrderAcceptance>
